

Run Date,Action,Symbol,Description,Type,Exchange Quantity,Exchange Currency,Currency,Price,Quantity,Exchange Rate,Commission,Fees,Accrued Interest,Amount,Cash Balance,Settlement Date
04/10/2026,REINVESTMENT FIDELITY SELECT SEMICONDUCTORS PORT (FSELX) (Cash),FSELX,FIDELITY SELECT SEMICONDUCTORS PORT,Cash,0,,USD,49.57,2.807,0,,,,-139.24,0.00,
04/10/2026,REINVESTMENT FIDELITY 500 INDEX FUND (FXAIX) (Cash),FXAIX,FIDELITY 500 INDEX FUND,Cash,0,,USD,236.87,0.085,0,,,,-20.01,139.24,
04/10/2026,DIVIDEND RECEIVED FIDELITY 500 INDEX FUND (FXAIX) (Cash),FXAIX,FIDELITY 500 INDEX FUND,Cash,0,,USD,,0.000,0,,,,20.01,159.25,
04/10/2026,REINVESTMENT FIDELITY TOTAL MARKET INDEX FUND (FSKAX) (Cash),FSKAX,FIDELITY TOTAL MARKET INDEX FUND,Cash,0,,USD,187.12,0.263,0,,,,-49.25,139.24,
04/10/2026,DIVIDEND RECEIVED FIDELITY TOTAL MARKET INDEX FUND (FSKAX) (Cash),FSKAX,FIDELITY TOTAL MARKET INDEX FUND,Cash,0,,USD,,0.000,0,,,,49.25,188.49,
04/10/2026,SHORT-TERM CAP GAIN FIDELITY SELECT SEMICONDUCTORS PORT (FSELX) (Cash),FSELX,FIDELITY SELECT SEMICONDUCTORS PORT,Cash,0,,USD,,0.000,0,,,,23.53,139.24,
04/10/2026,LONG-TERM CAP GAIN FIDELITY SELECT SEMICONDUCTORS PORT (FSELX) (Cash),FSELX,FIDELITY SELECT SEMICONDUCTORS PORT,Cash,0,,USD,,0.000,0,,,,115.71,115.71,
03/30/2026,REINVESTMENT SCHWAB STRATEGIC TR 1000 INDEX ETF (SCHK) (Cash),SCHK,SCHWAB STRATEGIC TR 1000 INDEX ETF,Cash,0,,USD,30.75,0.620,0,,,,-19.0,0.00,
03/30/2026,DIVIDEND RECEIVED SCHWAB STRATEGIC TR 1000 INDEX ETF (SCHK) (Cash),SCHK,SCHWAB STRATEGIC TR 1000 INDEX ETF,Cash,0,,USD,,0.000,0,,,,19.0,19.04,
01/07/2026,REINVESTMENT GLOBAL X FDS DAX GERMANY ETF (DAX) (Cash),DAX,GLOBAL X FDS DAX GERMANY ETF,Cash,0,,USD,46.33,0.134,0,,,,-6.28,0.00,
01/07/2026,DIVIDEND RECEIVED GLOBAL X FDS DAX GERMANY ETF (DAX) (Cash),DAX,GLOBAL X FDS DAX GERMANY ETF,Cash,0,,USD,,0.000,0,,,,6.28,6.28,



"The data and information in this spreadsheet is provided to you solely for your use and is not for distribution. The spreadsheet is provided for"
"informational purposes only, and is not intended to provide advice, nor should it be construed as an offer to sell, a solicitation of an offer to buy or a"
"recommendation for any security or insurance product by Fidelity or any third party. Data and information shown is based on information known to Fidelity as of the date it was"
"exported and is subject to change. It should not be used in place of your account statements or trade confirmations and is not intended for tax reporting"
"purposes. For more information on the data included in this spreadsheet, including any limitations thereof, go to Fidelity.com."

"Brokerage services are provided by Fidelity Brokerage Services LLC (FBS), 900 Salem Street, Smithfield, RI 02917. Custody and other services provided by National"
"Financial Services LLC (NFS). Both are Fidelity Investment companies and members SIPC, NYSE. Insurance products at Fidelity are distributed by"
"Fidelity Insurance Agency, Inc., and, for certain products, by Fidelity Brokerage Services, Member NYSE, SIPC."

Date downloaded 01/01/2026 12:00 pm
